article;author;date;link;origin;subtitle;title;type
O prefeito de Fortaleza, Sarto Nogueira (PDT), anunciou nesta quinta-feira (7) novos nomes do segundo escalão da sua equipe de secretários. Ainda são aguardados os nomes dos titulares das Secretarias Executivas Regionais, cobiçada por vários aliados do pedetista, principalmente vereadores, já que as pastas devem ser usadas para aproximar a administração pública da população. Entre os nomes anunciados, estão Juliana Carla Coelho Cavalcante, na Superintendência da Autarquia Municipal de Trânsito (AMC): Riane Azevedo, na Superintedência do IJF: e Eudoro Santana, na Coordenadoria Especial de Programas Integrados. Confira a lista dos secretários anunciados: Regionais A expectativa é de que ainda hoje sejam anunciados os titulares das Regionais. No fim da gestão, o ex-prefeito Roberto Cláudio (PDT) editou um decreto regulamentando a divisão da Capital em 12 regionais – fragmentando as sete que existiam até então. Com a mudança, além de tirar do papel uma mudança aprovada ainda em 2019 pela Câmara dos Vereadores, a Prefeitura deixou a possibilidade de Sarto acomodar mais aliados. No novo desenho administrativo, as 12 regionais irão compor a Secretaria Municipal de Gestão Regional (Seger), comandada por João Pupo. Sob responsabilidade das “subprefeituras”, ficarão as manutenções referentes aos bairros que a integram, como limpeza de espaços públicos, recapeamento de ruas e avenidas, além da capinação. As Regionais também serão as responsáveis pela manutenção preventiva de equipamentos públicos, como creches, escolas e postos de saúde. Secretariado No último dia 30 de dezembro, Sarto havia anunciado os nomes de 20 titulares de secretarias. Em seguida, Manuela Nogueira e Esio Feitosa (PSB) também foram indicados, com status de secretários, como coordenadores especiais de Programas Integrados e de Articulação Política, respectivamente.;Redação;17:11 / 07 de Janeiro de 2021.;https://diariodonordeste.verdesmares.com.br/politica/veja-quem-sarto-nogueira-ja-indicou-para-o-segundo-escalao-da-prefeitura-de-fortaleza-1.3030540;Diário do Nordeste;A expectativa agora é pela divulgação dos nomes dos titulares das 12 secretarias regionais;Veja quem Sarto Nogueira já indicou para o segundo escalão da Prefeitura de Fortaleza;Política
"Assinada pelo presidente Jair Bolsonaro (sem partido), a nota que tenta diminuir a tensão provocada pelo chefe do Executivo nacional com os outros poderes, especialmente o Judiciário, não convenceu deputados federais do Ceará. Nomes da oposição repetem que sinais de moderação do presidente “não enganam mais ninguém”. Já parlamentares mais alinhados a Bolsonaro dizem torcer por uma pacificação entre os poderes. A carta, divulgada na tarde desta quinta-feira (9), foi escrita pelo ex-presidente Michel Temer (MDB) e assinada pelo atual mandatário. O experiente emedebista foi convocado de forma emergencial pelo atual presidente em uma tentativa de conter a escalada de tensão com o Judiciário, principalmente com o ministro Alexandre de Moares, do Supremo Tribunal Federal (STF). Leia mais O magistrado foi o principal alvo do presidente e de seus apoiadores durante os atos convocados para o dia 7 de setembro. Bolsonaro chegou a chamá-lo de “canalha”. Moraes comanda o inquérito que apura atos antidemocráticos e já ordenou a prisão de diversos aliados do presidente, como o ex-deputado Roberto Jefferson (PTB), o deputado federal Daniel Silveira (PSL) e, mais recentemente, Zé Trovão, líder da paralisação nacional dos caminhoneiros. O governador Camilo Santana (PT) comentou a nota de Bolsonaro. ""Que o gesto do presidente neste dia se transforme em ações práticas de respeito à democracia e às instituições. Ninguém neste País está acima da lei e da Constituição"", escreveu, nas redes sociais. Recuos Leia também Para o deputado federal José Guimarães (PT), os recuos do presidente após ataques às instituições “já viraram moda”. “Ele não engana mais ninguém. Essa mea culpa não serve mais para nada. Ele dá dez passos na destruição da democracia e depois recua um”, critica o petista. Análise semelhante é feita por André Figueiredo (PDT). “Bolsonaro mostrou o que ele é, um covarde. Na frente das massas que enfeitiça é um leão, fora dela é um gatinho. Vimos quão fraco é o nosso presidente, que insufla seus seguidores, mas, na hora do aperto, foge da luta”, afirma o deputado. Correligionário de Figueiredo, Idilvan Alencar (PDT) aponta que o recuo presidencial se impôs devido às reações ao 7 de Setembro. “O número de pessoas foi aquém do que eles esperavam, a Bolsa de Valores caiu, o dólar subiu e eles perderam o controle sobre a paralisação dos caminhoneiros. Ele tinha a intenção de dar um golpe no dia 7, mas foi uma aposta errada”, aponta. Pressão seguirá Deputados da oposição reafirmam ainda que as articulações para que o presidente da Câmara abra um processo de impeachment contra Bolsonaro permanecem. Conforme o Diário do Nordeste mostrou nesta quinta-feira (9), os parlamentares, no entanto, reconhecem que as chances são baixas devido à aliança do presidente com o Centrão. Veja também “Vamos continuar fazendo uma oposição forte. A popularidade dele está em queda e ele cometeu crime de responsabilidade, isso não se apaga. Quando um cidadão comete um crime, ele é punido. Com o presidente tem que ser do mesmo jeito, não é porque ele diz que se arrependeu que vamos deixar para lá”, aponta Idilvan. “Vimos hoje o sinal claro de um Governo que chegará ao seu fim antes de terminar o mandato”, acrescenta Guimarães. “Maturidade” Um dos aliados mais próximos a Bolsonaro no Ceará, o deputado Dr. Jaziel (PL) fez um apelo, nas redes sociais, para que os eleitores “confiem no presidente”. “Lembram do clima de decepção que a mídia criou quando Moro acusou o presidente? Pois é. Paciência, meus amigos”, diz o parlamentar. Heitor Freire (PSL) exaltou a postura do presidente em divulgar a nota. ""Eu não tenho dúvidas que esse é o caminho que precisamos adotar no Brasil. Temos pautas urgentes e é preciso foco para resolver. Alguém que tinha que levantar a bandeira branca, e fico feliz que tenha sido o presidente, é um sinal de maturidade e compromisso com o cargo que ocupa"", afirma. O tucano Danilo Forte (PSDB) também falou sobre a importância de pacificar a relação entre os três poderes. Segundo ele, a única saída para as crises política e econômica do Brasil é o diálogo. “Nenhum país do mundo se desenvolveu com guerra interna ou dissolução de poderes constitucionais, então a maturidade se impõe. É necessário pensar em como sair dessas crises”, ressalta. “Eu louvo a carta apresentada pelo presidente Bolsonaro e espero que ela tenha longevidade. Espero que a gente possa atravessar esse momento difícil, consiga desarmar os espíritos golpistas e conduzir o País para um processo de eleições livres e democraticas”, conclui o deputado tucano. ""O bem comum"" Na nota oficial, Bolsonaro afirma nunca ter tido a intenção de agredir quaisquer dos poderes. “Quero declarar que minhas palavras, por vezes contundentes, decorreram do calor do momento e dos embates que sempre visaram o bem comum”, diz. ""Reitero meu respeito pelas instituições da República, forças motoras que ajudam a governar o País. Democracia é isso: Executivo, Legislativo e Judiciário trabalhando juntos em favor do povo e todos respeitando a Constituição"", acrescenta o presidente.";Igor Cavalcante;20:35 / 09 de Setembro de 2021.;https://diariodonordeste.verdesmares.com.br/pontopoder/deputados-cearenses-veem-com-cautela-e-descrenca-nota-de-pacificacao-de-bolsonaro-1.3133907;Diário do Nordeste;Parlamentares mais próximos ao presidente dizem torcer por moderação na relação entre os poderes: Camilo Santana também se manifestou;Deputados cearenses veem com cautela e descrença nota de “pacificação” de Bolsonaro;PontoPoder
O anúncio da aquisição de 3 milhões de doses da vacina CoronaVac para o Ceará, feito nessa terça-feira (10), pelo governador Camilo Santana (PT), marca também a consolidação de acordos diretos entre o Governo do Estado e farmacêuticas. Ao todo, o Estado investirá R$ 178,5 milhões na compra – a um custo de R$ 59 por dose. Paralelamente, o chefe do Executivo cearense informou ainda que negocia a aquisição do imunizante da Pfizer. O anúncio ocorreu cerca de uma semana após a suspensão da compra da Sputnik V. A negociação ocorre diretamente com o Instituto Butantan, de São Paulo. A aquisição, de acordo com o Governo do Estado, ocorre devido à distribuição irregular de imunizantes por parte do Governo Federal, que administra o Programa Nacional de Imunizações (PNI). No caso da Pfizer, o governador cearense enviou, em junho deste ano, um ofício manifestando interesse em negociar a compra direta das vacina. Em dezembro do ano passado, o Governo do Estado havia procurado a empresa, mas, à época, afarmacêutica alegou que negociava com a União Leia também Sem negócio O fechamento de contratos diretos do Governo do Ceará chega justamente no momento em que imbróglios burocráticos e sanitários resultaram na revogação do acordo entre o Instituto Gamaleya para a aquisição de vacinas Sputnik V. Em 16 de março deste ano, o governador Camilo Santana sancionou a lei aprovada pela Assembleia Legislativa do Ceará que permitia a compra de 5,8 milhões de doses da vacina russa. Em junho, a Agência Nacional de Vigilância Sanitária (Anvisa) concedeu autorização excepcional para uso do imunizante. A importação foi aprovada sob condições controladas, como o uso exclusivo para indivíduos adultos saudáveis e com a a Anvisa podendo, a qualquer momento, suspender a importação, a distribuição e o uso das vacinas importadas. A autorização também previa a importação de doses para atender apenas 1% da população. A chegada das primeiras doses chegou a ser anunciáda para o último dia 28 de julho. No entando, no último dia 5 de agosto, o impasse chegou ao fim. Para o epidemiologista Edson Teixeira, a decisão dos governadores foi acertada. “Me preocupei com a decisão porque seria quase um estudo clínico em quantidade pequena de pessoas saudáveis. Os dados relativos à segurança (da vacina) não foram testados no Brasil, foram oferecidos pelo Instituto Gamaleya, então há uma sequência de coisas que colocou em dúvida a qualidade e eficácia do imunizante”, disse.;Igor Cavalcante;07:00 / 11 de Agosto de 2021.;https://diariodonordeste.verdesmares.com.br/pontopoder/sem-sputnik-v-governo-do-ceara-busca-alternativas-na-compra-direta-de-vacinas-1.3121355;Diário do Nordeste;Governador anuncia aquisição de doses da CoronaVac e negociação para compra de imunizantes da Pfizer;Sem Sputnik V, Governo do Ceará busca alternativas na compra direta de vacinas;PontoPoder
"A réplica de um fuzil feita com peças recicladas de carros e motos que o presidente Jair Bolsonaro (sem partido) ganhou de presente e exibiu durante a live desta quinta-feira (10) foi feita por um artesão cearense, ex-funcionário da Polícia Federal e que há 25 anos faz esculturas de metal. Ao receber a peça do chefe da Força Nacional de Segurança, o também cearense coronel Aginaldo, o presidente gerou polêmica ao comentar o uso do armamento pesado “em uma comunidade” do Rio de Janeiro. O motorista aposentado José Pereira de Araújo Neto, 63, que trabalhou 24 anos na Polícia Federal, em Juazeiro do Norte, fabricou a obra usando peças de sucata. “Eu vi que o presidente gosta muito de arma e decidi fazer de presente”, conta. “Me sinto feliz, é o reconhecimento do meu trabalho”, diz o artesão, que é natural de Iguatu e atualmente reside em Fortaleza. Leia mais O fuzil entregue ao Chefe do Executivo leva a assinatura do artista, a data de fabricação, o nome “Jair Bolsonaro” grafado e o data de aniversário do Presidente da República. Artesão Araújo acompanhou a já tradicional transmissão ao vivo que o presidente faz toda semana. “Na hora, muitos amigos me mandaram mensagem, trechos do vídeo”, conta. Esse, porém, é mais um trabalho reconhecido do artista cearense. Uma escultura do Padre Cícero feita com mais de duas toneladas de sucata de ferro e 3,5 metros de altura enfeitou por muitos anos a entrada do prédio da PF em Juazeiro do Norte, no Cariri. Feita totalmente com peças de veículos, a obra é uma das maiores vitrines do artista, que também fabrica pequenas reproduções de carros e animais. ""Tenho peça em todo canto, no Brasil e no exterior, como Portugal e França"", diz. No Ceará, além da escultura na Delegacia da Polícia Federal de Juazeiro e as da Superintendência, em Fortaleza, o artista fez peças que foram doadas para a Força Aérea e para a Marinha. Fala do presidente O chefe da Força Nacional publicou vídeo do momento em que o presidente fala sobre o assunto na live: A post shared by Coronel Aginaldo 🇧🇷 (@coronel_aginaldo)";Felipe Azevedo;11:22 / 11 de Junho de 2021.;https://diariodonordeste.verdesmares.com.br/politica/replica-de-fuzil-exibida-em-live-de-bolsonaro-foi-presente-de-artista-cearense-conheca-1.3096499;Diário do Nordeste;Motorista aposentado da PF fabricou a réplica do armamento para presentear o Presidente da República;Réplica de fuzil exibida em live de Bolsonaro foi presente de artista cearense: conheça;Política
"Deputados estaduais cearenses que vão concorrer à reeleição e novos candidatos a uma vaga na Assembleia Legislativa do Ceará aguardam a definição das regras eleitorais de 2022 para decidir o rumo nos partidos. Nos bastidores, a sondagem para troca de siglas é intensa, mas diante das mudanças na legislação que estão por vir ainda há cautela. A ""corrida"" por partidos ocorre devido às novas regras que deverão ser colocadas em prática na eleição proporcional (de deputado federal e estadual) do ano que vem. O epicentro das preocupações é a proibição das coligações que, a exemplo do que aconteceu na eleição de vereador, no ano passado, tem impacto para praticamente todas as legendas. Desafios para as legendas Sem coligação, partidos não poderão se juntar a outros e terão que montar chapas com candidatos competitivos para que possam disputar sozinhos vagas na Câmara Federal e na Assembleia Legislativa. Só a existência dessa regra já preocupa quem está no mandato e quem vai concorrer pela primeira vez, porque numa coligação os partidos contam com votos de candidatos dos outros, facilitando o alcance do chamado quociente eleitoral. Quando dois ou mais partidos se jutam, fica mais fácil atingir a quantidade mínima de votos para conquistar uma vaga. Em uma chapa ""pura"", no entanto, os candidatos têm de avaliar a média de votos dos colegas de partido para saber as chances de serem eleitos naquela legenda. Muitos se afastam caso o partido tenha muitos candidatos competitivos. Leia mais Sondagem de partidos Por isso, desde cedo parlamentares se movimentam em busca de partidos para avaliar se permanecem onde estão ou se migram para outro que lhe dê melhores condições eleitorais. Até lá, o que não falta é sondagem entre os parlamentares. Na Assembleia Legislativa, alguns parlamentares já são dados como certos de que vão embarcar em novas siglas. Adesões ao PP Os deputados estaduais Audic Mota (PSB) e Manoel Duca (PDT) deverão migrar para o Progressistas, mais conhecido como PP, a segunda maior bancada da Casa. Também pode migrar para a legenda Zezinho Albuquerque, do PDT, deputado estadual licenciado e secretário de Cidades do governo Camilo Santana. Legenda: Audic Mota é um dos que estuda trocar de partido para a Eleição 2022Foto: José Leomar Zezinho é pai do presidente do PP no Ceará, deputado federal AJ Albuquerque, e eles têm tentado atrair mais candidatos para fortalecer o partido. Audic Mota ainda não confirma, mas cogita a mudança. O ex-prefeito de São Benedito, Gadyel Gonçalves, também faz tratativas com o PP. Filiado ao PCdoB, ele avalia as condições de disputar uma vaga na Câmara Federal pelo partido que está. A cláusula de barreira foi uma regra aprovada na minirreforma eleitoral em 2018 que impõe aos partidos quantidade de candidatos eleitos na Câmara Federal para terem acesso ao fundo partidário e ao tempo de propaganda no rádio e na TV. Em 2022, as legendas terão que atingir ao menos 2% dos votos válidos, ou seja, eleger 11 deputados federais distribuídos em noves estados. Articulações em curso A deputada estadual Augusta Brito, esposa de Gadyel, também é do PCdoB, e, segundo ele, também pode deixar o partido. Ela já recebeu convite do governador Camilo Santana, do PT, para se filiar à sigla petista e disputar a reeleição. Nomes novos que deverão disputar uma vaga no Legislativo em 2022 também estão de olho no melhor partido para abrigá-los. O secretário de Direitos Humanos de Fortaleza, Cláudio Pinho, deve se candidatar a deputado estadual e avalia a permanência no PDT. O fato é que a maioria dos futuros candidatos a deputado em 2022 aguarda a definição das regras eleitorais para decidir o rumo nos partidos. O deputado estadual Jeová Mota (PDT) que vai disputar a reeleição, não pretende sair da sigla, mas diz que colegas na Assembleia estão na expectativa pelas. ""A gente está esperando as regras, o formato. Se vai ser distritão, se vai ter coligação, existe uma incerteza ainda das regras. Elas vão definir o caminho de muitos"". Regras eleitorais Existem três comissões na Câmara Federal discutindo mudanças na legislação eleitoral. Para valerem em 2022, elas precisam ser aprovadas pela Câmara e Senado até outubro deste ano. As principais propostas em debate são: Uma das principais propostas é o distritão, modelo pelo qual são eleitos os parlamentares mais votados, independente dos partidos. Hoje, no sistema proporcional, tanto os votos dados nos candidatos como nas legendas contam no cálculo para distribuição das vagas. Voto majoritário O distritão divide opiniões no Congresso Nacional. Alguns apontam que esse modelo enfraquece os partidos e provoca desigualdade entre candidatos que terão mais e menos estrutura na campanha. Já a deputada estadual Silvana Oliveira (PL) acha que esse novo sistema seria mais justo. Ela afirma que se for aprovado, descarta de vez sair do partido que está. Tanto Silvana Oliveira como o esposo, deputado federal Jaziel Pereira, também no PL, vão disputar a reeleição no ano que vem. Federações Outra mudança em discussão é a criação de federações partidárias. Pela proposta, duas ou mais legendas poderão se unir e deverão ficar juntas, no mínimo, por quatro anos nas esferas municipal, estadual e federal. Nesse modelo, os partidos pequenos ameaçados pela cláusula de barreira poderão ter acesso ao fundo partidário e ao tempo de rádio e TV, porque estarão numa espécie de coligação. Em outra frente está em discussão o voto impresso, que são as cédulas dos votos dados na urna eletrônica. Além disso, são debatidos mudanças na Lei da Ficha Limpa e no poder do Tribunal Superior Eleitoral (TSE) de editar resoluções.";Letícia Lima;18:37 / 29 de Junho de 2021.;https://diariodonordeste.verdesmares.com.br/pontopoder/distritao-e-coligacoes-regras-eleitorais-forcam-deputados-a-adiar-decisoes-para-eleicao-2022-1.3101132;Diário do Nordeste;Novas regras em debate no Congresso trazem incertezas. Vejam deputados que podem mudar de partido;Distritão e coligações: regras eleitorais forçam deputados a adiar decisões para Eleição 2022;PontoPoder
