article;author;date;link;origin;subtitle;title;type
A dança das cadeiras entre titulares e suplentes é prática comum no Parlamento. Por vezes, acomoda interesses e ideologias dentro de um mesmo grupo político, mas não é sempre que isso acontece. Nos próximos dois anos, porém, com o fim das coligações proporcionais, será possível observar um fenômeno que tende a diminuir após as atuais legislaturas na Câmara dos Deputados e nas assembleias estaduais: a troca de deputados com histórico e posicionamentos distintos. Até lá, a bancada cearense no Legislativo federal retomará os trabalhos, em fevereiro, com ao menos três mudanças em sua composição. A mais nova troca ocorrerá nesta semana: Aníbal Gomes (DEM), suplente de uma coligação de seis partidos, assume a vaga de Mauro Filho (PDT), que se licencia para assumir a Secretaria do Planejamento e Gestão do Estado (Seplag). Além desta, desde o último dia 10 de dezembro, Danilo Forte (PSDB) substitui, em definitivo, Roberto Pessoa (PSDB), empossado prefeito de Maracanaú. No dia 21 também do mês passado, Gorete Pereira (PL), suplente de uma coligação com seis legendas, assumiu, interinamente, a vaga de Luizianne Lins (PT), licenciada por 120 dias para cuidar da tese de doutorado. O risco das mudanças entre nomes divergentes politicamente, porém, deve ser menor na próxima legislatura com o fim das coligações para eleições proporcionais, válido a partir do pleito de 2020 para vereador. A regra impedirá que partidos diferentes, e possivelmente com acentuadas diferenças, somem, juntos, votos para eleger candidatos das legendas coligadas. Contradições Especialistas apontam, na atuação dos suplentes, diferenças perceptíveis ao eleitor, que pode ter, na prática, distorcida a vontade política do voto. “Luizianne e Gorete são de partidos, de ideologias e de trajetórias completamente diferentes. Mauro Filho e Aníbal também”, exemplifica cientista político e professor universitário Cleyton Monte. “Talvez um pouco mais próximos sejam o Danilo e o Roberto Pessoa”, analisa ele, que considera que as trocas “bagunçam o processo democrático”. “Esses 120 dias podem ser decisivos, porque vai ter, por exemplo, a eleição da Mesa Diretora, e a Gorete provavelmente pode ter um posicionamento diferente do da Luizianne”, observa o pesquisador do Laboratório de Estudos sobre Política, Eleições e Mídia da Universidade Federal do Ceará (Lepem-UFC). Também pesquisador do Lepem, o cientista político Emanuel Freitas avalia que, com as mudanças, o candidato apoiado por Jair Bolsonaro (sem partido) na disputa pela Presidência da Câmara, Arthur Lira (PP), deve sair ganhando. “O Danilo Forte sempre foi mais ligado à pauta da direita e à atuação do Centrão, então não diferirá muito o voto que ele provavelmente dará e o que o Roberto Pessoa daria. E a Gorete também, que apesar de ter feito parte da base de apoio do Lula e da Dilma, sempre foi uma deputada cuja atuação tendeu mais para esse espectro do Centrão, o que faz com que a bancada cearense deva garantir mais votos ao candidato do Bolsonaro, em vez do candidato do Rodrigo Maia (Baleia Rossi, do MDB-SP)”, projeta. Atuação Depois de já ter assumido interinamente por 120 dias, entre junho e outubro, enquanto Roberto Pessoa cuidava da campanha, Danilo Forte agora tem metade de um mandato em definitivo, o que, para ele, muda o perfil de atuação. “Agora você pode fazer um trabalho de longo prazo, você vira um membro definitivo das comissões temáticas, você pode ter uma longevidade para relatar uma matéria mais profunda. Você passa a ser reconhecido de forma diferenciada, e o próprio sistema funcional da Casa permite ao efetivo certas regalias que o suplente não tem”, explica o parlamentar, que coloca como “prioridade zero” recuperar o auxílio emergencial e agilizar a vacina contra a Covid-19. Já Gorete Pereira não terá tanto tempo para colocar em prática suas prioridades, mas tem nas mãos uma oportunidade pela qual vinha brigando desde o ano passado, quando tentava, sem sucesso, articular sua saída da suplência junto ao governador Camilo Santana (PT), que, sem entendimento na bancada, acabou nomeando a aliada como assessora de Relações Institucionais da Casa Civil. Agora, Gorete, que é de centro-direita, ocupa a vaga de Luizianne, deputada de esquerda. “Vou lutar principalmente para que a Câmara vote as medidas necessárias, como são as reformas, que é incrível não terem sido votadas, principalmente a reforma tributária”, afirma. Ela também cita como prioridades a articulação da instalação de um porto seco no Ceará e a aprovação da Medida Provisória 1.016/2020, que permite a renegociação de dívidas de empresas com bancos de fundos constitucionais, como o Banco do Nordeste. Outras mudanças Já no início desta semana, Mauro Filho também se licencia da Câmara. Aníbal Gomes, que embora em junho do ano passado tenha sido condenado a 13 anos de prisão pelo Supremo Tribunal Federal (STF) por corrupção e lavagem de dinheiro na Operação Lava Jato, assume pela segunda oportunidade a cadeira do pedetista, pois ainda cabe recurso. A substituição deve ensejar uma mudança no perfil da Casa, que perde a atuação técnica de Mauro Filho na área econômica. Ele afirma que se licencia com sensação de “dever cumprido”, após relatar proposta de ajuste fiscal para estados e municípios (com redefinições para gastos com pessoal, despesas correntes, prioridades de investimentos, entre outros pontos) para 2021 e conseguir aprovar e enviar ao Senado projeto de sua autoria que libera R$ 168 bilhões de fundos federais para o caixa direto do Governo. “Com essa medida, o Governo vai diminuir a velocidade de crescimento da dívida pública brasileira, que é o fator de maior desconfiança para os investidores”, frisa. Eleições Outras trocas entre titulares e suplentes, motivadas pelas eleições municipais, também marcaram o último ano legislativo na bancada cearense. Em julho de 2020, Vaidon Oliveira (Pros) se licenciou por 120 dias para dar lugar a Deuzinho Filho, que hoje está no Republicanos, mas se candidatou em 2018 pelo Pros. A ideia era fortalecer a chapa encabeçada por Vitor Valim (Pros), que foi eleita para a Prefeitura de Caucaia, com Deuzinho como vice-prefeito. Por ser apenas o terceiro suplente da coligação, ele teve que contar com articulação que fez Agripino Magalhães e Julierme Sena, primeiro e segundo suplentes, declinarem de assumir. Dr. Agripino assumiria no mês seguinte, mas a cadeira de Capitão Wagner (Pros), que se licenciou para cuidar da campanha na Capital. Também em agosto, Domingos Neto (PSD) se licenciou por 120 dias para dar lugar a Ronaldo Martins (Republicanos), como parte de acordo que envolvia o apoio à reeleição de Ednaldo Lavor (PSD) no município de Iguatu. Rotatividade na Assembleia Na Assembleia Legislativa do Estado, cinco prefeitos eleitos deram lugar a suplentes, que tiveram efetivadas vagas anteriormente ocupadas de forma apenas provisória, durante licenças dos titulares. Com a saída de Sarto Nogueira (PDT) para a Prefeitura de Fortaleza, Manoel Duca (PDT) ocupa cadeira em definitivo. Segundo suplente da coligação, Duquinha vinha sendo constantemente beneficiado por licenças de colegas, como Fernando Hugo (PP), Bruno Pedrosa (PP), Leonardo Pinheiro (PP) e Tin Gomes (PDT). Com a eleição de Nezinho Farias (PDT), o primeiro suplente Lucílvio Girão (PP), que já vinha ocupando cadeira de Zezinho Albuquerque (PDT), nomeado secretário das Cidades, passa a ser titular. Tony Brito (Pros), anteriormente contemplado por licença de Soldado Noélio (Pros), também assumiu em definitivo, com a eleição de Vitor Valim (Pros) em Caucaia. Já Bruno Gonçalves (PL) mais uma vez deu lugar a Gordim Araújo (Patriota), só que agora em definitivo, pois foi eleito prefeito de Aquiraz. E Davi de Raimundão (MDB), que já ocupou cadeiras de Danniel Oliveira (MDB) e Leonardo Araújo (MDB), agora ocupa a vaga de Patrícia Aguiar (PSD), empossada em Tauá. Fato é que os próximos dois anos devem ser os últimos com tanta rotatividade nos parlamentos federal e estaduais. Segundo Cleyton Monte, os acordos para garantir mandatos de suplentes devem ser menos frequentes nas próximas legislaturas. “É quase que uma tradição no Legislativo brasileiro, mas, com o fim das coligações proporcionais, isso deve ser reduzido significativamente”, afirma o cientista político. Já Emanuel Freitas observa que o fim das coligações tende a fortalecer grupos políticos dentro dos partidos. “Esses grupos podem ser fisiológicos, familiares, regionais e também ideológicos, mas não necessariamente a ideologia em si sairá fortalecida com o fim das coligações”, pondera.;Flávio Rovere;23:00 / 03 de Janeiro de 2021.;https://diariodonordeste.verdesmares.com.br/politica/trocas-na-bancada-federal-cearense-expoem-contrastes-ideologicos-1.3029096;Diário do Nordeste;O Ceará inicia o ano legislativo com mudanças de representantes que podem ter impacto direto na atividade parlamentar. Trocas com posicionamentos distintos em Brasília, porém, devem ser reduzidas a partir das próximas legislaturas, com o fim das coligações proporcionais válido desde 2020;Trocas na bancada federal cearense expõem contrastes ideológicos;Política
"O PDT inicia, neste fim de semana, uma série de encontros no Ceará com lideranças do partido e dá o pontapé inicial nos preparativos para as eleições de 2022. A agenda marca a posição defendida pela sigla dentro do grupo governista de indicar o candidato à sucessão do governador Camilo Santana (PT) e servirá de estratégia para dar visibilidade aos pedetistas cotados, até o momento, para a disputa pelo Palácio da Abolição. Os encontros do PDT no Ceará vão começar pela região do Cariri. O primeiro ocorre, neste sábado (11), em Brejo Santo. Em seguida, no domingo (12), está marcado outro evento em Barbalha. O senador Cid Gomes, uma das principais lideranças do partido, estará presente. A ideia é que o irmão, Ciro Gomes, provável candidato à Presidência da República em 2022, também participe. No domingo, porém, Ciro deve comparecer à manifestação contra o presidente Jair Bolsonaro (sem partido) em São Paulo. Leia também Sucessão estadual O fato é que todas as lideranças do partido foram convidadas, entre prefeitos, vereadores, deputados estaduais e deputados federais. O presidente do PDT no Ceará, deputado federal André Figueiredo, afirma que a presença deles nos eventos será importante para que ganhem visibilidade no interior. Esses encontros sinalizam para o arco de aliança governista no Estado a posição do PDT de indicar o candidato à sucessão de Camilo Santana. No entanto, alas do PT, partido do governador, também defendem candidatura própria ao Palácio da Abolição. Impasses no grupo O impasse ocorre por causa do cenário nacional. Tudo indica que PT e PDT estarão em lados opostos na eleição presidencial, com o ex-presidente Lula e Ciro Gomes na disputa. Além disso, as críticas de Ciro a Lula incomodam petistas e tensionam a relação. Apesar das turbulências, lideranças dos dois partidos avaliam que a aliança deve ser mantida no Ceará, com a indicação de Camilo para a vaga de senador na chapa e a condição de montar palanques diferentes: um para Ciro e outro para Lula. ""Sobre a aliança com o PT, temos o indicativo de trabalharmos (juntos). O governador é parte importante nesse processo para dar tudo certo"", apontou André Figueiredo. Camilo Santana é um dos principais fiadores da parceria do PT com o PDT, tanto que intermediou o encontro do ex-presidente Lula com o senador Cid Gomes, no fim de agosto, quando o petista visitou o Ceará. Manutenção da aliança O presidente do PT no Ceará, Antonio Conin, aponta para a manutenção da aliança com o PDT e concorda que, se Camilo for o candidato a senador na chapa governista, o ""razoável"" é que a sigla pedetista indique o candidato a governador. A definição do candidato governista a sucessor de Camilo Santana, contudo, só acontecerá no ano que vem e, se seguir a tradição do grupo, só será conhecida pelo público na última hora antes das convenções partidárias. Vitrine do PDT O líder do PDT na Assembleia, deputado estadual Guilherme Landim, afirma que os encontros regionais do partido servirão para discutir as eleições de 2022 estadual e nacional. Para o deputado estadual pedetista, Marcos Sobreira, os encontros serão uma oportunidade de dar visibilidade às lideranças do partido cotadas para concorrer ao Governo do Estado. Para Sobreira, a ""cabeça"" da chapa majoritária ser do PDT, ou seja, a candidatura ao cargo de governador, é ""prego batido"". ""Sem qualquer menosprezo aos outros (partidos do grupo governista), mas nós somos o maior (partido), o que tem mais prefeitos, a maior bancada estadual, federal, partido da vice-governadora. É mais do que justo que o PDT, que já administrou o Estado, volte a administrar"", defendeu. Oposição Os encontros do PDT começam em meio às movimentações da oposição no Ceará. O deputado federal Capitão Wagner (Pros), principal liderança da oposição, tem percorrido o Estado, inclusive, nos últimos dias, esteve em Sobral, berço políticos dos irmãos Cid e Ciro Gomes.";Letícia Lima;08:50 / 11 de Setembro de 2021.;https://diariodonordeste.verdesmares.com.br/pontopoder/pdt-inicia-encontros-regionais-no-ceara-com-cotados-a-sucessao-de-camilo-santana-e-mira-2022-1.3134291;Diário do Nordeste;Ao todo serão 12 encontros regionais que começam, neste fim de semana, com a presença de lideranças do partido;PDT inicia encontros regionais no Ceará com cotados à sucessão de Camilo Santana e mira 2022;PontoPoder
"A condução do governo federal quanto à crise causada pela pandemia de Covid-19 tem sido alvo de críticas frequentes dos deputados federais e senadores. Os congressistas apontam que as ações adotadas até aqui não são suficientes e, com o Brasil chegando a 300 mil mortes pela doença, subiram o tom contra o Governo Bolsonaro. Nesta quinta-feira (25), dia da votação do Orçamento no Congresso Nacional, com clima de tensão entre Executivo e Legislativo, até mesmo o vice-presidente da República, Hamilton Mourão (PRTB), fez críticas ao Governo. ""Agora vamos enfrentar o que está aí e tentar de todas as formas diminuir a quantidade de gente contaminada e, obviamente, o número de óbitos, que já ultrapassou o limite do bom senso"", disse ele, após comentar reunião entre Bolsonaro, presidentes do Congresso Nacional e governadores. Leia Mais O presidente da Câmara dos Deputados, Arthur Lira (PP), já havia subido o tom contra o governo na quarta-feira (24). O deputado afirmou que, se não houver correção de rumo, a crise pode resultar em ""remédios políticos amargos"" a serem usados pelo Congresso, alguns deles fatais. A afirmação foi feita após Lira participar de reunião entre Bolsonaro, o presidente do Senado, Rodrigo Pacheco (DEM), e governadores. Na ocasião, foi anunciada a criação de um comitê para o acompanhamento de crise pelo governo federal - o anúncio ocorre mais de um ano depois do início da pandemia. Legenda: Arthur Lira citou ""remédios políticos amargos"" do Congresso ao criticar o governo federalFoto: Marcelo Camargo/Agência Brasil CRÍTICAS NA CONDUÇÃO DA CRISE As críticas de Lira foram corroboradas por outros parlamentares federais, incluindo do Centrão - bloco que vinha se alinhando ao Palácio do Planalto. “A Câmara não poderia tolerar de forma passiva a morte de 300 mil brasileiros e brasileiras, parte delas decorrentes de erros gravíssimos de condução do enfrentamento da pandemia"", afirmou o vice-presidente da Câmara dos Deputados, Marcelo Ramos (PL). Apesar da cobrança feita, o presidente Bolsonaro afirmou, nesta quinta-feira, que ""não tem problema nenhum"" entre ele e Lira. ""O que nós queremos juntos é buscar maneira de contratarmos mais vacinas. Fazer que chegue as informações de que as vacinas estão sendo realmente aplicadas"", disse. Ainda assim, o clima no Congresso Nacional tem se acirrado. Oposição ao governo federal, o senador Cid Gomes (PDT) pediu o afastamento da condução dos assuntos referentes à pandemia. Para ele, o Congresso deve substituir o presidente nesse papel de liderança. RENÚNCIA DE MINISTRO Ainda na quarta-feira (24), senadores pediram a demissão do ministro das Relações Exteriores, Ernesto Araújo. Em audiência com a presença do chanceler, os parlamentares criticaram a postura do Itamaraty no cenário mundial. Legenda: Durante audiência no Senado, parlamentares pediram a renúncia do chanceler Ernesto AraújoFoto: Waldemir Barreto/Agência Senado ""Peço um favor: renuncie a esse ministério. Em nome do país, renuncie. É esse o apelo que faço. Ministro, pelos brasileiros, renuncie"", disse a Araújo o senador Tasso Jereissati (PSDB). O tucano não foi o único a pedir a renúncia do chanceler. Randolfe Rodrigues (Rede), Mara Gabrili (PSDB), Jean Paul Prates e Jorge Kajuru (Cidadania) foram alguns dos que insistiram na saída do ministro. ""Peça para mudar. Vá para um ministério ideológico. Não fique no Ministério das Relações Exteriores. O senhor é unanimidade no Senado de rejeição e incompetência"", corroborou Simone Tebet (MDB). IMPASSE NA APROVAÇÃO DO ORÇAMENTO Em meio ao aumento de pressões ao governo Bolsonaro, o impasse dentro da base governista atrasou a votação do Orçamento 2021 pelo Congresso Nacional. Os parlamentares pressionaram por mais recursos para as emendas parlamentares. Legenda: Comissão Mista de Orçamento (CMO) aprovou relatório do Orçamento 2021 nesta quinta (25)Foto: Pablo Valadares/Câmara dos Deputados Indo contra a indicação da equipe econômica do governo, o relator da matéria, senador Márcio Bittar (MDB), decidiu retirar cerca de R$ 26,5 bilhões dos recursos para pagamento, por exemplo, do seguro-desemprego e da Previdência Social. A redução foi usada para bancar o aumento da verba de outros ministérios, principalmente das pastas ligadas a obras, como Desenvolvimento Regional e Infraestrutura. Com isso, os congressistas ampliaram para quase R$ 49 bilhões a fatia que devem controlar no Orçamento de 2021. Dentre os acréscimos, Bittar incluiu recursos para recuperação de ativos da União, obras em rodovias no Ceará, no Pará e em Santa Catarina, entre outros estados, construção de viadutos e regularização fundiária. A redução, principalmente, nas contas da Previdência preocupa técnicos do Ministério da Economia. A tesourada nesta área foi de R$ 13,6 bilhões. O problema, segundo membros da equipe econômica, é que a verba para pagar aposentadorias e pensões já estava abaixo do considerado ideal. O buraco, de acordo com cálculos do começo da semana, era que a Previdência precisaria de mais R$ 8 bilhões aproximadamente. O texto ainda pode ser alterado. A votação deve ocorrer ainda nesta quinta-feira (25) tanto na Câmara dos Deputados como no Senado Federal.";Luana Barros/Diário do Nordeste/FolhaPress;17:31 / 25 de Março de 2021.;https://diariodonordeste.verdesmares.com.br/politica/pressao-aumenta-sobre-governo-bolsonaro-diante-de-recordes-da-pandemia-e-atraso-no-orcamento-1.3064996;Diário do Nordeste;Congressistas têm intensificado críticas e ameaças à gestão federal: parlamentares cearenses pediram mudanças na condução da crise sanitária;Pressão aumenta sobre Governo Bolsonaro diante de recordes da pandemia e atraso no Orçamento;Política
article;author;date;link;origin;subtitle;title;type
Em depoimento à CPI da Covid nesta quarta-feira (22), o diretor-executivo da Prevent Sênior, Pedro Benedito Batista Júnior, afirmou que pacientes infectados com a Covid-19 passaram a exigir a prescrição da cloroquina após declarações feitas pelo presidente Jair Bolsonaro e por pessoas influentes. O remédio, que já se comprovou ineficaz no combate ao coronavírus, foi amplamente divulgado por Bolsonaro e por seus apoiadores. A declaração do diretor do plano de saúde foi feita após pergunta do senador Renan Calheiros (MDB-AL) sobre o impacto “dessa promoção feita pelo presidente da República na decisão da Prevent de patrocinar o uso da hidroxicloroquina”. “Quem prescreve qualquer medicação é o próprio médico e naquele momento houve, até devido a pronunciamentos não só da Presidência, mas de outras pessoas influentes também, uma série de pacientes exigindo a prescrição da medicação”, afirmou o executivo. “Isso, quando veio ao encontro dos médicos que estavam na linha de frente tentando salvar vida dos pacientes, tornou-se uma situação, como não havia respostas ainda, necessária para que houvesse, após feita a prescrição, medicação disponível”, acrescentou. Batista Júnior afirmou ainda que não há “problema” e “não há crime” no fato de a operadora oferecer a medicação “após prescrição do médico”.;Marcela Mattos e Sara Resende, g1 e TV Globo;22/09/2021 13h00;https://g1.globo.com/politica/cpi-da-covid/noticia/2021/09/22/cpi-diretor-da-prevent-diz-que-pacientes-exigiram-cloroquina-apos-falas-de-bolsonaro-e-pessoas-influentes.ghtml;G1 Ceará;;CPI: diretor da Prevent diz que pacientes exigiram cloroquina após falas de Bolsonaro e pessoas 'influentes';politica
A agenda do presidente Jair Bolsonaro foi atualizada e informa agora que ele fará, por videoconferência, do Palácio da Alvorada, o único compromisso previsto para esta quarta-feira (22), uma reunião com Pedro Cesar Sousa, subchefe para Assuntos Jurídicos da Secretaria-Geral da Presidência da República. Essa mudança na agenda ocorre após a Agência Nacional de Vigilância Sanitária (Anvisa) recomendar que autoridades que tiveram contato em Nova York com o ministro da Saúde, Marcelo Queiroga, que recebeu diagnóstico positivo para Covid-19, fiquem em isolamento por 14 dias. Queiroga fez parte da comitiva do presidente Jair Bolsonaro em viagem oficial aos Estados Unidos, onde ele participou da Assembleia Geral das Organização das Nações Unidas (ONU). O diagnóstico de Queiroga ocorreu na terça (21), pouco antes do embarque de volta ao Brasil. O ministro da Saúde decidiu permanecer em Nova York, isolado em um hotel. De acordo como Palácio do Planalto, Bolsonaro e todo o restante da comitiva se submeteram a testes para Covid, que deram negativo. O assessoria do Palácio do Planalto não informou se o presidente Jair Bolsonaro e os ministros cumprirão a quarentena. A Casa Civil, que recebeu o documento com a recomendação da Anvisa, também não informou se os integrantes da comitiva que viajou aos Estados Unidos farão o isolamento. O presidente chegou a Brasília nesta quarta (22) da viagem aos Estados Unidos por volta das 7h. Ele desembarcou na Base Aérea de Brasília e seguiu no comboio presidencial para o Palácio da Alvorada. VÍDEOS: assista a mais notícias sobre política;Pedro Henrique Gomes, g1;22/09/2021 12h57;https://g1.globo.com/politica/noticia/2021/09/22/apos-anvisa-orientar-isolamento-bolsonaro-troca-reuniao-com-assessor-por-videoconferencia.ghtml;G1 Ceará;Agência orientou que comitiva do presidente fique isolada após ministro da Saúde, Marcelo Queiroga, receber diagnóstico positivo para Covid-19 durante viagem a Nova York.;Após Anvisa orientar isolamento, Bolsonaro troca reunião com assessor por videoconferência;politica
