article;author;date;link;origin;subtitle;title;type
"O presidente Jair Bolsonaro (sem partido) transferiu para o presidente da Câmara, Rodrigo Maia (DEM-RJ), a responsabilidade por beneficiários do Bolsa Família não receberem uma 13ª parcela do programa neste ano. O deputado respondeu chamando o chefe do Executivo de ""mentiroso"". A 13º cota do benefício era uma promessa de campanha de Bolsonaro e foi paga apenas em 2019 por meio de uma MP (medida provisória). Durante a tramitação no Congresso, o relator da matéria, senador Randolfe Rodrigues (Rede-AP), propôs que a parcela extra fosse estabelecida para todos os anos seguintes. A medida perdeu a validade em 25 de março, quando estava na pauta da Câmara dos Deputados e ainda seguiria para o Senado. ""Você está reclamando do 13º do Bolsa Família, que não teve. Sabia que não teve este ano? Foi promessa minha? Foi. Foi pago no ano passado? Mas o presidente da Câmara deixou caducar a MP. Vai cobrar de mim? Cobra do presidente da Câmara, que o Supremo agora não deu o direito de ele disputar a reeleição. Cobra dele"", disse Bolsonaro em sua transmissão semana pela internet na noite desta quinta-feira (17). À época, porém, a MP não foi votada por causa de uma articulação do próprio governo, que previa um impacto de R$ 8 bilhões aos cofres públicos. ""Nunca imaginei que Bolsonaro fosse mentiroso"", disse Maia à reportagem, ao ser informado da acusação feita pelo presidente na live. ""Foi pedido do governo, mas tem um projeto do deputado Darci de Matos [PSD-SC] criando o 13º. Posso votar amanhã [sexta-feira (17)], se ele quiser"", afirmou o presidente da Câmara. O projeto de lei nº 4439/20 autoriza o pagamento, no mês de dezembro de cada ano, de abono de até um salário mínimo à pessoa com deficiência e ao idoso com mais de 65 anos que recebam o BPC (Benefício de Prestação Continuada). Bolsonaro e Maia sempre tiveram uma relação tensa, mas isso piorou nos últimos dias porque Bolsonaro está patrocinando a candidatura do líder do Progressistas na Câmara, Arthur Lira (AL), na disputa pelo comando da Casa. O STF (Supremo Tribunal Federal) barrou a possibilidade de Maia tentar a reeleição para o cargo. Agora, o deputado tenta viabilizar um candidato para enfrentar o nome apoiado pelo Palácio do Planalto. Jair Bolsonaro comentou o assunto ao rebater críticas de seus seguidores na internet por estar apoiando a candidatura do líder do centrão, grupo de partidos que troca cargos e emendas por sustentação no Congresso, ao qual o presidente da República, em campanha, havia dito que não se aliaria. ""Vai mudar [sic] as Mesas da Câmara e do Senado, agora, em 1º de fevereiro. Já sofro críticas por isso, né? 'Ah, não quero este cara'. Ô, cara, quem você quer? Vai e arranja 257 votos na Câmara e 41 votos no Senado para o teu candidato, para o seu cara, que você acha que é o bom. Eu estou, logicamente, acompanhando as eleições nas duas Casas. O que eu pretendo na Mesa da Câmara e do Senado? Eu converso com parlamentar, fui 28 anos parlamentar. Que alguém que vá para lá que não trave as pautas de interesse do Brasil, que bote em votação as matérias"", disse Bolsonaro.";Folhapress;10:12 / 18 de Dezembro de 2020.;https://diariodonordeste.verdesmares.com.br/politica/bolsonaro-diz-que-bolsa-familia-nao-tera-13-por-culpa-de-maia-que-chama-presidente-de-mentiroso-1.3023916;Diário do Nordeste;À época, porém, a MP não foi votada por causa de uma articulação do próprio governo, que previa um impacto de R$ 8 bilhões aos cofres públicos;Bolsonaro diz que Bolsa Família não terá 13º por culpa de Maia, que chama presidente de mentiroso;Política
"As eleições suplementares para prefeito, que ocorreram em três municípios do Ceará neste domingo (1º)tiveram policiamento reforçado em Martinópole, Missão Velha e Pedra Branca, além de atuação da Polícia Federal (PF). Uma ocorrência de boca de urna foi registrada em Pedra Branca. Leia mais De acordo com balanço divulgado pela PF, foi lavrado um Termo Circunstanciado de Ocorrência (TCO) pelo crime neste domingo. Já em Missão Velha, policiais federais encontraram ""diversos materiais de campanha"". O fato, no entanto, não configurou flagrante de propaganda eleitoral irregular, pois os materiais não estavam sendo distribuídos no momento. Os objetos foram recolhidos e encaminhados ao cartório eleitoral. ""Os trabalhos da PF vêm sendo desenvolvidos presencialmente nos municípios durante toda a última semana, com o objetivo de garantir a segurança e a normalidade do pleito eleitoral"", diz nota da corporação. Em Martinópole, no Norte do Estado, aglomerações durante o pleito foram dispersadas pela Polícia Militar. Segurança no município teve apoio ainda Coordenadoria Integrada de Operações Aéreas (Ciopaer). Compra de votos Três mandados de busca e apreensão foram cumpridos na última quinta-feira (29), em Missão Velha, por compra de votos. De acordo com a PF, não houve prisões. O clima de acirramento no município do Cariri ocorre desde a semana passada, quando duas passeatas de militantes adversários se encontrou no Centro da cidade. Após um princípio de tumulto os grupos foram dispersados.";Matheus Facundo;19:57 / 01 de Agosto de 2021.;https://diariodonordeste.verdesmares.com.br/pontopoder/pedra-branca-registra-boca-de-urna-em-eleicoes-neste-domingo-policiamento-em-cidades-foi-reforcado-1.3117292;Diário do Nordeste;Três municípios cearenses escolheram novos prefeitos em eleições suplementares hoje;Pedra Branca registra boca de urna em eleições neste domingo: policiamento em cidades foi reforçado;PontoPoder
"O presidente Jair Bolsonaro disse na noite desta terça-feira (1°) que o processo de filiação ao Patriota está ""quase certo"", mas ainda depende de alguns detalhes. A declaração veio horas depois de Bolsonaro se reunir com o presidente do Patriota, Adilson Barroso, no Planalto.""Todo mundo é Patriota agora?"", perguntou um apoiador ao presidente, na portaria do Palácio da Alvorada. ""Está quase certo, estamos negociando. É como um casamento: tem de ser programado, planejado, senão dá problema"", respondeu Bolsonaro.No mesmo momento, uma apoiadora se identificou como integrante do Patriota Mulher do Distrito Federal e disse que gostaria de ""somar"" com Bolsonaro. ""Não casei ainda, não"", respondeu ele, numa referência ao partido. ""Quando vai ser esse casamento?"", insistiu a apoiadora. ""Eu acho que a mulher marca o dia do casamento, para ser democrático, e o homem marca o ano"", respondeu o presidente, rindo.Bolsonaro foi eleito presidente em 2018 pelo Partido Social Liberal (PSL), sigla que deixou em novembro de 2019 após desentendimentos com o deputado Luciano Bivar (PE), presidente da legenda. Sem partido desde então, Bolsonaro vinha procurando um que o abrigasse para disputar novo mandato, em 2022. O Patriota chegou a remover alguns integrantes, como o vereador paulistano Fernando Holiday, ligado ao Movimento Brasil Livre (MBL), para atrair Bolsonaro.Na segunda-feira (31), o filho do presidente e senador Flávio Bolsonaro (RJ) se filiou ao Patriota. A chegada dele ao partido foi vista como uma sinalização o presidente da República o companhará em breve.Na conversa com os apoiadores, Bolsonaro aproveitou para ironizar o governador de São Paulo, João Doria (PSDB), e disse que o ministro da Infraestrutura, Tarcísio de Freitas, poderá disputar com o tucano o Palácio dos Bandeirantes, em 2022. CPI da Covid e Copa América Ao falar sobre a CPI da Covid, o presidente disse que senadores ficaram uma hora ""batendo"" na médica oncologista Nise Yamaguchi, defensora do tratamento precoce à base de cloroquina para combater o coronavírus. "" É uma covardia"", afirmou Bolsonaro sobre a forma como senadores interpelaram Nise, que prestava depoimento como convidada. ""Relatório do Renan não dá nem para botar no banheiro porque vai estar mais sujo do que o papel higiênico que estiver lá"", atacou ele, numa referência ao relator da CPI, Renan Calheiros (MDB-AL). Em pouco mais de meia hora de conversa, na entrada do Alvorada, Bolsonaro também fez uma oração com os apoiadores, falou sobre o fim da ""festa da Lei Rouanet"" e confirmou que o Brasil receberá os jogos da Copa América de Futebol.""Sexta-feira começam as eliminatórias da Copa do Mundo, Equador e Brasil, ninguém falou nada. Agora, Copa América já começaram a me adjetivar de tudo o que se possa imaginar. Mas ganhamos mais uma. Do que depender do governo federal e de quatro governadores que se voluntariaram (Brasília, Mato Grosso, Goiás e Rio de Janeiro), haverá Copa América. E, quem não quiser assistir, não assista"", finalizou.";Estadão Conteúdo;09:26 / 02 de Junho de 2021.;https://diariodonordeste.verdesmares.com.br/politica/jair-bolsonaro-diz-a-apoiadores-que-filiacao-ao-patriota-esta-quase-certa-1.3093021;Diário do Nordeste;O filho do presidente, senador Flávio Bolsonaro, se filiou ao partido na segunda-feira (31);Jair Bolsonaro diz a apoiadores que filiação ao Patriota está 'quase certa';Política
Os candidatos à Prefeitura de Porto Alegre, Sebastião Melo (MDB) e Manuela D'Ávila (PC do B) vão disputar o segundo turno das eleições na Capital gaúcha. Com 100% das urnas apuradas, o candidato do MDB recebeu 34,53% dos votos (200.280). Já a opositora, do PC do B, obteve 29% dos votos (187.262 ao todo).;Redação;01:29 / 16 de Novembro de 2020.;https://diariodonordeste.verdesmares.com.br/politica/sebastiao-melo-e-manuela-davila-disputam-o-segundo-turno-das-eleicoes-em-porto-alegre-1.3011724;Diário do Nordeste;O candidato do MDB recebeu 31,01% dos votos e o concorrente do PC do B obteve 29%;Sebastião Melo e Manuela D'Ávila disputam o segundo turno das eleições em Porto Alegre;Política
"Contrariando o valor máximo de R$ 375 proposto pelo Governo Federal para a nova rodada do auxílio emergencial, prevista para ser paga a partir de abril, ao menos 54 parlamentares já apresentaram emendas à Medida Provisória (MP) 1.039 para tentar aumentar o valor do repasse. A maioria das propostas prevê que o benefício volte a ser de R$ 600, mudança defendida por seis deputados cearenses. O custo total do auxílio emergencial, de R$ 44 bilhões, foi autorizado pelo Congresso Nacional por meio da chamada PEC Emergencial, promulgada em 15 de março. Os valores, de acordo com a MP, variam de R$ 150 a R$ 375. Em carta assinada por mais 15 chefes de executivo, o governador Camilo Santana (PT), ainda no início desta semana, reiterou o pedido de parlamentares de que a gestão federal pudesse rever a proposta. Leia mais O texto do Executivo, apresentado no último dia 18 de março, já conta com mais de 280 emendas. As sugestões de aditivos também pedem a extensão do auxílio para mais pessoas, inclusão de categorias de trabalho e também que o repasse perdure até o final do ano. Câmara e Senado têm 120 dias, a partir da data de apresentação do documento, para aprovar a MP e convertê-la em Lei. Levantamento feito pelo Diário do Nordeste mostra que ao menos 54 parlamentares travam no Congresso uma luta para que o benefício tenha valor acrescido. Os dados são da Câmara dos Deputados. Na bancada cearense, os deputados André Figueiredo (PDT), Célio Studart (PV), Danilo Forte (PSDB), Denis Bezerra (PSB), Eduardo Bismark (PDT) e José Guimarães (PT) tentam convencer, através das emendas, que o auxílio emergencial volte a ser de R$ 600. Argumentos e ideias A ideia de deputados e senadores, inicialmente, é tentar viabilizar a modificação ainda durante a discussão do texto. O Governo Federal quer pagar por quatro meses, a partir de abril, valores que variam de R$ 150 a R$ 375. Ainda durante a votação da PEC Emergencial, deputados cearenses iniciaram também uma onda de justificativas, principalmente nas redes sociais, ao votarem pela não aprovação da proposta. A intenção, segundo argumentaram, era deixar que claro que o posicionamento era contra o valor do novo auxílio emergencial, não o benefício em si. Legenda: O ministro da Economia, Paulo Guedes, participou de audiência pública no SenadoFoto: Palácio do Planalto Já há, no entanto, sinalização de dentro do Governo de que possa haver acréscimo no valor do auxílio. Na última quinta-feira (25), o ministro Paulo Guedes (Economia), em audiência no Congresso, disse quer Legislativo e Executivo devem trabalhar juntos em maneiras de aumentar a transferência de recursos aos mais pobres, como o auxílio emergencial e o Bolsa Família. Ele defendeu que a elevação dos recursos seja acompanhada de contrapartidas nas contas públicas. Leia mais Para o cientista político Edir Veiga, professor da Universidade Federal do Pará (UFPA), o movimento do Congresso é esperado e trata-se de uma ""luta política"", na qual o Executivo propõe um valor baixo para o benefício, já contando com emendas modificativas a serem apresentadas. ""O Governo quer priorizar a responsabilidade fiscal, e vai radicalizar no preço para baixo para permitir que os deputados possam radicalizar para cima. Isso já funciona no Congresso: já se conta com isso, já se trabalha com isso"", analisa. Ainda na ocasião, Guedes disse que o auxílio não é mais alto porque, em sua visão, o Estado brasileiro carrega uma máquina aparelhada de ativos como estatais e não mobiliza os recursos aos mais vulneráveis.  Segundo Edir Veiga, o Governo Federal tem criado polêmica ""em algo em que poderia ser amplamente vitorioso"". ""Bastava que o falasse a linguagem da Organização Mundial da Saúde e falaria também com os governadores. Mas o Governo se ocupou em centrar fogo em cima da manutenção da vida econômica do País"". Propostas do Ceará Cinco dos seis deputados do Ceará autores de sugestões à MP propuseram emendas que modificam o valor do auxílio para R$ 600. Uma delas, no entanto, prevê que esse repasse seja feito em nove parcelas, e não apenas em quatro vezes – como propôs o Governo. Outra estabelece que o valor mínimo do repasse seja de R$ 300, e não de R$ 150, como previsto na MP. Nessa mesma emenda, pede-se que mulheres chefes de família tenham garantia para receber R$ 600. Como eles justificam cada emenda André Figueiredo (PDT):Ao propor a mesma forma do benefício que a maioria dos colegas de bancada, o pedetista argumenta que “o valor da cesta básica tem subido mês a mês e seu valor médio, considerando a média de todos os estados brasileiros, é de R$400,00”. Célio Studart (PV): Propõe valor de R$ 600 por nove meses a partir de março. Mulheres chefes de família receberiam R$ 1.200. Ele defende que ""o valor de R$ 250,00 proposto na Medida Provisória (...) é insuficiente para garantir a sobrevivência das famílias"". Danilo Forte (PSDB): Emenda prevê o valor mínimo de R$ 300 em quatro parcelas. Mães chefes de família receberiam a cota dobrada, também por quatro meses. “A alta dos preços é sentida principalmente por essa população mais pobre” justifica o parlamentar. Denis Bezerra (PSB):Propõe quatro parcelas mensais de R$ 600, e R$ 1.200 para mulheres que são monoparentais. ""O Congresso tem a tarefa de elevar o auxílio para garantir o mínimo de dignidade para as famílias brasileiras mais vulneráveis"", sustenta. Eduardo Bismark (PDT): Auxílio seria pago em quatro parcelas de R$ 600: mulheres que chefiam lares teriam direito a duas cotas, somando R$ 1.200. O deputado argumenta que o auxílio em 2021 equivale a 41% do oferecido ano passado, “ isso em um contexto muito mais grave e calamitoso da pandemia. José Guimarães (PT): “Fica instituído, até 31 de dezembro de 2021, o auxílio emergencial residual a ser pago em até nove parcelas mensais no valor de R$ 600,00”, diz a emenda. Na justificativa, ele faz ponderação sobre o risco de queda no PIB caso não haja transferência de renda.";Felipe Azevedo;05:00 / 29 de Março de 2021.;https://diariodonordeste.verdesmares.com.br/politica/deputados-cearenses-buscam-aumentar-auxilio-emergencial-para-r-600-54-emendas-tentam-novo-valor-1.3065586;Diário do Nordeste;Parlamentares defendem retomada do benefício nos moldes do ano passado, contrariando a proposta atual: seis emendas são do Ceará;Deputados cearenses buscam aumentar auxílio emergencial para R$ 600: 54 emendas tentam novo valor;Política
"O presidente do Senado Federal, Rodrigo Pacheco (DEM-MG), iniciou, na tarde desta terça-feira (13) a leitura do requerimento de abertura da Comissão Parlamentar de Inquérito (CPI) da Covid-19. A investigação foi determinada pelo ministro Luís Roberto Barroso, do Supremo Tribunal Federal (STF), na última quinta-feira (8) para investigar a responsabilidade do Governo Federal na condução da pandemia. O ministro Barroso concedeu liminar em mandado de segurança apresentado em março pelos senadores Alessandro Vieira e Jorge Kajuru, do Cidadania, e liberou o tema para julgamento colegiado no plenário virtual da Corte. Ele também acatou o pedido de senadores da oposição, que buscavam a instalação da comissão por Pacheco. Leia mais A proposta da CPI, elaborada por Randolfe Rodrigues (Rede-AP), alcançou 32 assinaturas, mais do que as 27 necessárias para avançar. Com o pedido dos parlamentares, Barroso concordou que Pacheco era obrigado a instalar a CPI. O presidente do Senado, porém, foi contra a ideia: ele afirmou que teria direito a um ""juízo de conveniência"", podendo julgar se a realização da comissão seria conveniente em algum momento — o que, no caso da CPI da Covid-19, ele discorda. Leia também O objetivo da CPI, conforme o pedido de Randolfe Rodrigues, é ""apurar as ações e omissões do Governo Federal no enfrentamento da pandemia da Covid-19 no Brasil e, em especial, no agravamento da crise sanitária no Amazonas com a ausência de oxigênio para os pacientes internados"". Inicialmente, portanto, o foco é o Governo Federal, começando pelos casos de falta de oxigênio em Manaus no mês de janeiro deste ano, quando a proposta foi elaborada, e a coleta de assinaturas, iniciada. O presidente Jair Bolsonaro criticou o pedido inicial — para ele, a conduta de estados e municípios também deveria ser apurada. O chefe do Executivo nacional chegou a dizer que o foco no governo dele se deu para produzir um ""relatório sacana"". O regimento interno da Casa, contudo, impede que uma CPI investigue prefeitos e governadores.";Redação;17:23 / 13 de Abril de 2021.;https://diariodonordeste.verdesmares.com.br/politica/senado-federal-inicia-abertura-da-cpi-da-covid-19-nesta-terca-feira-13-1.3072652;Diário do Nordeste;Ministro Luís Roberto Barroso, do STF, determinou instalação da comissão, que vai apurar ações do Governo Federal na pandemia;Senado Federal inicia abertura da CPI da Covid-19 nesta terça-feira (13);Política
